title,url
Language Support for Marginalia Search,https://www.marginalia.nu/log/a_126_multilingual/
Show HN: I'm rewriting a web server written in Rust for speed and ease of use,https://ferron.sh/
AWS multiple services outage in us-east-1,https://health.aws.amazon.com/health/status?ts=20251020
Practical Scheme,https://practical-scheme.net/index.html#docs
Show HN: I'm making a detective game built on Wikipedia,https://detective.wiki/
A laser pointer at 2B FPS [video],https://www.youtube.com/watch?v=o4TdHrMi6do
Pasta/80 is a simple Pascal cross compiler targeting the Z80 microprocessor,https://github.com/pleumann/pasta80
Bare Metal (The Emacs Essay),https://waxbanks.wordpress.com/2025/08/01/bare-metal-the-emacs-essay/
The Tyrrany of Literacy. On oral tradition and what is lost,https://languagelog.ldc.upenn.edu/nll/?p=71545
Alibaba Cloud says it cut Nvidia AI GPU use by 82% with new pooling system,https://www.tomshardware.com/tech-industry/semiconductors/alibaba-says-new-pooling-system-cut-nvidia-gpu-use-by-82-percent
Production RAG: what I learned from processing 5M+ documents,https://blog.abdellatif.io/production-rag-processing-5m-documents
My trick for getting consistent classification from LLMs,https://verdik.substack.com/p/how-to-get-consistent-classification
BERT is just a single text diffusion step,https://nathan.rs/posts/roberta-diffusion/
Human Error Cripples the Internet (1997),https://archive.nytimes.com/www.nytimes.com/library/cyber/week/071797dns.html
When Compiler Optimizations Hurt Performance,https://nemanjatrifunovic.substack.com/p/when-compiler-optimizations-hurt
Claude Code on the web,https://www.anthropic.com/news/claude-code-on-the-web
I made a small LED panel,https://www.stavros.io/posts/really-small-led-panel/
Today is when the Amazon brain drain sent AWS down the spout,https://www.theregister.com/2025/10/20/aws_outage_amazon_brain_drain_corey_quinn/
Show HN: I created a cross-platform GUI for the JJ VCS (Git compatible),https://judojj.com
Old Computer Challenge – Modern Web for the ZX Spectrum,https://0x00.cl/blog/2025/occ-2025/
"Calendar Puzzle ""Rhombus""",https://praxispuzzles.com/calendar_puzzle_rhombus
ChkTag: x86 Memory Safety,https://community.intel.com/t5/Blogs/Tech-Innovation/open-intel/ChkTag-x86-Memory-Safety/post/1721490
How to stop Linux threads cleanly,https://mazzo.li/posts/stopping-linux-threads.html
Space Elevator,https://neal.fun/space-elevator/
Optical diffraction patterns made with a MOPA laser engraving machine [video],https://www.youtube.com/watch?v=RsGHr7dXLuI
Results from blood test for 50 cancers,https://www.bbc.com/news/articles/c205g21n1zzo
Code from MIT's 1986 SICP video lectures,https://github.com/felipap/sicp-code
x86-64 Playground – An online assembly editor and GDB-like debugger,https://x64.halb.it/
DeepSeek OCR,https://github.com/deepseek-ai/DeepSeek-OCR
The longest baseball game took 33 innings to win,https://www.mlb.com/news/the-longest-professional-baseball-game-ever-played
"TernFS – an exabyte scale, multi-region distributed filesystem",https://www.xtxmarkets.com/tech/2025-ternfs/#posix-shaped
"The scariest ""user support"" email I've received",https://www.devas.life/the-scariest-user-support-email-ive-ever-received/
"Postman which I thought worked locally on my computer, is down",https://status.postman.com
Servo v0.0.1,https://github.com/servo/servo
A magnetic field orientation that changes the fundamental design of motors,https://www.paranetics.com/copy-of-home
Show HN: Playwright Skill for Claude Code – Less context than playwright-MCP,https://github.com/lackeyjb/playwright-skill
"60k kids have avoided peanut allergies due to 2015 advice, study finds",https://www.cbsnews.com/news/peanut-allergies-60000-kids-avoided-2015-advice/
Wikipedia Seems Pretty Worried About AI,https://nymag.com/intelligencer/article/wikipedia-contributors-are-worried-about-ai-scraping.html
What I Self Host,https://fredrikmeyer.net/2025/10/18/what-i-self-host.html
Art Must Act,https://aeon.co/essays/harold-rosenberg-exhorted-artists-to-take-action-and-resist-cliche
iOS 26.1 lets users control Liquid Glass transparency,https://www.macrumors.com/2025/10/20/ios-26-1-liquid-glass-toggle/
"The Peach meme: On CRTs, pixels and signal quality (again)",https://www.datagubbe.se/crt2/
J.P. Morgan's OpenAI loan is strange,https://marketunpack.com/j-p-morgans-openai-loan-is-strange/
Entire Linux Network stack diagram (2024),https://zenodo.org/records/14179366
What went down at WCSB 89.3FM: Cleveland State's axed student radio station,https://www.cleveland.com/news/2025/10/what-went-down-at-wcsb-893fm-a-voice-from-inside-cleveland-states-axed-student-radio-station.html
Getting DeepSeek-OCR Working on an Nvidia Spark via Brute Force with Claude Code,https://simonwillison.net/2025/Oct/20/deepseek-ocr-claude-code/
"When a stadium adds AI to everything, it's worse experience for everyone",https://a.wholelottanothing.org/bmo-stadium-in-la-added-ai-to-everything-and-what-they-got-was-a-worse-experience-for-everyone/
The Death of Thread per Core,https://buttondown.com/jaffray/archive/the-death-of-thread-per-core/
Docker Systems Status: Full Service Disruption,https://www.dockerstatus.com/pages/incident/533c6539221ae15e3f000031/68f5e1c741c825463df7486c
Fractal Imaginary Cubes,https://www.i.h.kyoto-u.ac.jp/users/tsuiki/icube/fractal/index-e.html
Atomic-Scale Protein Filters,https://press.asimov.com/articles/filters
Exploring IRC (Internet Relay Chat),https://blog.preahs.com/exploring-irc-internet-relay-chat/
Doing well in your courses: Andrej's advice for success (2013),https://cs.stanford.edu/people/karpathy/advice.html
Don't Force Your LLM to Write Terse [Q/Kdb] Code: An Information Theory Argument,https://medium.com/@gabiteodoru/dont-force-your-llm-to-write-terse-code-an-argument-from-information-theory-for-q-kdb-developers-04077c5b7038
Peanut allergies have plummeted in children,https://www.nytimes.com/2025/10/20/well/peanut-allergy-drop.html
Automate all the things with Swift Subprocess,https://blog.jacobstechtavern.com/p/swift-subprocess
"Optimizing writes to OLAP using buffers (ClickHouse, Redpanda, MooseStack)",https://www.fiveonefour.com/blog/optimizing-writes-to-olap-using-buffers
The object that struck flight UA1093 was likely a weather balloon,https://fosstodon.org/@AkaSci/115410025095722538
Vaclav Smil on why there will be no energy transition,https://energyskeptic.com/2025/vaclav-smil-on-why-there-will-be-no-energy-transition/
Show HN: EloqDoc: MongoDB-compatible doc DB with object storage as first citizen,https://github.com/eloqdata/eloqdoc
Nuclear Exercising at NATO,https://walberque.substack.com/p/nuclear-exercising-at-nato
U.S. Banks Are Hunting for Collateral to Back $20B Argentina Bailout,https://www.wsj.com/finance/argentina-bailout-banks-collateral-721bc2b5
Novo Nordisk's Canadian Mistake,https://www.science.org/content/blog-post/novo-nordisk-s-canadian-mistake
Old Is Gold: Optimizing Single-Threaded Applications with Exgen-Malloc,https://arxiv.org/abs/2510.10219
What's Behind the Mysterious Ancient Wall in the Gobi Desert?,https://news.artnet.com/art-world/the-hunt-gobi-wall-mongolia-2674588
Pointer Pointer (2012),https://pointerpointer.com
Infisical (YC W23) Is Hiring Full Stack Engineers,https://www.ycombinator.com/companies/infisical/jobs/0gY2Da1-full-stack-engineer-global
Why UUIDs won't protect your secrets,https://alexsci.com/blog/uuids-and-idor/
Qt Group Buys IAR Systems Group,https://www.qt.io/stock/qt-completes-the-recommended-public-cash-offer-to-the-shareholders-of-iar-systems-group-1760351460000-3668995
Oskar Speck's 1932 Kayak Journey from Germany to Australia,https://nswskc.wordpress.com/2002/10/24/incredible-journey-50/
Dutch spy services have restricted intelligence-sharing with the United States,https://intelnews.org/2025/10/20/01-3416/
Forth: The programming language that writes itself,https://ratfactor.com/forth/the_programming_language_that_writes_itself.html
Duke Nukem: Zero Hour N64 ROM Reverse-Engineering Project Hits 100%,https://github.com/Gillou68310/DukeNukemZeroHour
Berty – an encrypted and offline peer-to-peer messenger with no central server,https://berty.tech/features
Chess grandmaster Daniel Naroditsky has died,https://old.reddit.com/r/chess/comments/1obnbmu/grandmaster_daniel_naroditsky_has_passed_away/
Subway station study reveals fungal communities,https://phys.org/news/2025-09-subway-station-reveals-fungal-communities.html
LoC is a dumb metric for functions,https://theaxolot.wordpress.com/2025/10/18/loc-is-a-dumb-metric-for-functions/
Hetzner: The Simple Cloud just got more flexible and more affordable,https://old.reddit.com/r/hetzner/comments/1o80yjs/the_simple_cloud_just_got_more_flexible_and_even/
Give Your Metrics an Expiry Date,https://adrianhoward.com/posts/give-your-metrics-an-expiry-date/
The FTC Is Disappearing Blog Posts About AI Published During Lina Khan's Tenure,https://www.wired.com/story/ftc-removes-blog-posts-about-ai-authored-by-by-lina-khan/
Bat v0.26.0,https://github.com/sharkdp/bat/releases/tag/v0.26.0
The macOS LC_COLLATE hunt: Or why does sort order differently on macOS and Linux (2020),https://blog.zhimingwang.org/macos-lc_collate-hunt
Daniel Naroditsky: Chess grandmaster dies unexpectedly aged 29,https://news.sky.com/story/daniel-naroditsky-chess-grandmaster-dies-unexpectedly-aged-29-13454230
From Hollywood to horticulture: Cate Blanchett on a mission to save seeds,https://www.bbc.com/news/articles/cwy7ekl4yl8o
"United MAX Hit by Falling Object at 36,000 Feet",https://avbrief.com/united-max-hit-by-falling-object-at-36000-feet/
Oma: An attempt at reworking APT's interface,https://github.com/AOSC-Dev/oma
Introduction to reverse-engineering vintage synth firmware,https://ajxs.me/blog/Introduction_to_Reverse-Engineering_Vintage_Synth_Firmware.html
QuickDrawViewer: A Mac OS X utility to visualise QuickDraw (PICT) files,https://github.com/wiesmann/QuickDrawViewer
Gleam OTP – Fault Tolerant Multicore Programs with Actors,https://github.com/gleam-lang/otp
Foreign hackers breached a US nuclear weapons plant via SharePoint flaws,https://www.csoonline.com/article/4074962/foreign-hackers-breached-a-us-nuclear-weapons-plant-via-sharepoint-flaws.html
"Abandoned land drives dangerous heat in Houston, study finds",https://stories.tamu.edu/news/2025/10/07/abandoned-land-drives-dangerous-heat-in-houston-texas-am-study-finds/
How to Assemble an Electric Heating Element from Scratch,https://solar.lowtechmagazine.com/2025/10/how-to-build-an-electric-heating-element-from-scratch/
Show HN: Pyversity – Fast Result Diversification for Retrieval and RAG,https://github.com/Pringled/pyversity
Andrej Karpathy – It will take a decade to work through the issues with agents,https://www.dwarkesh.com/p/andrej-karpathy
Dosbian: Boot to DOSBox on Raspberry Pi,https://cmaiolino.wordpress.com/dosbian/
Retinal Implant Restores Central Vision in Patients with Advanced AMD,https://www.upmc.com/media/news/102025-retinal-implant
Compare Single Board Computers,https://sbc.compare/
The Human Only Public License,https://frederic.vanderessen.com/posts/hopl/
The Cancer Imaging Archive (TCIA),https://www.cancerimagingarchive.net/
Matrix Conference 2025 Highlights,https://element.io/blog/the-matrix-conference-a-seminal-moment-for-matrix/
IDEs we had 30 years ago and lost (2023),https://blogsystem5.substack.com/p/the-ides-we-had-30-years-ago-and
Improving PixelMelt's Kindle Web Deobfuscator,https://shkspr.mobi/blog/2025/10/improving-pixelmelts-kindle-web-deobfuscator/
Comparing the power consumption of a 30 year old refrigerator to a new one,https://ounapuu.ee/posts/2025/10/14/fridge-power-consumption/
"Pawn is a simple, typeless, 32-bit extension language with a C-like syntax",https://www.compuphase.com/pawn/pawn.htm
Wikipedia says traffic is falling due to AI search summaries and social video,https://techcrunch.com/2025/10/18/wikipedia-says-traffic-is-falling-due-to-ai-search-summaries-and-social-video/
"GNU Octave Meets JupyterLite: Compute Anywhere, Anytime",https://blog.jupyter.org/gnu-octave-meets-jupyterlite-compute-anywhere-anytime-8b033afbbcdc
The Accountability Problem,https://www.jamesshore.com/v2/blog/2025/the-accountability-problem
Using Emacs as a TUI,https://blog.natfu.be/emacs-in-terminal-ergonomics/
How I bypassed Amazon's Kindle web DRM,https://blog.pixelmelt.dev/kindle-web-drm/
"It was a weather balloon, not space debris, that struck a United Airlines plane",https://arstechnica.com/space/2025/10/the-mystery-object-that-struck-a-plane-in-flight-it-was-probably-a-weather-balloon/
Titan submersible’s $62 SanDisk memory card found undamaged at wreckage site,https://www.tomshardware.com/pc-components/microsd-cards/tragic-oceangate-titan-submersibles-usd62-sandisk-memory-card-found-undamaged-at-wreckage-site-12-stills-and-nine-videos-have-been-recovered-but-none-from-the-fateful-implosion
Discussion of the Benefits and Drawbacks of the Git Pre-Commit Hook,https://yeldirium.de/2025/10/09/pre-commit-hooks/index.html
Look at how unhinged GPU box art was in the 2000s (2024),https://www.xda-developers.com/absolutely-unhinged-gpu-box-art-from-the-early-2000s/
Deterministic multithreading is hard (2024),https://www.factorio.com/blog/post/fff-415
Beaver-engineered dam in the Czech Republic,https://en.wikipedia.org/wiki/Beaver-engineered_dam_in_the_Czech_Republic
The Spilhaus Projection: A world map according to fish,https://southernwoodenboatsailing.com/news/the-spilhaus-projection-a-world-map-according-to-fish
First Self-Propagating Worm Using Invisible Code Hits OpenVSX and VS Code,https://www.koi.ai/blog/glassworm-first-self-propagating-worm-using-invisible-code-hits-openvsx-marketplace
Nvidia has produced the first Blackwell wafer on US soil,https://www.xda-developers.com/nvidia-produced-first-blackwell-wafer-us-soil/
Show HN: Open-Source Voice AI Badge Powered by ESP32+WebRTC,https://github.com/VapiAI/vapicon-2025-hardware-workshop
Ask HN: What are people doing to get off of VMware?,item?id=45635940
Scheme Reports at Fifty,https://crumbles.blog/posts/2025-10-18-scheme-reports-at-fifty.html
"Claude Skills are awesome, maybe a bigger deal than MCP",https://simonwillison.net/2025/Oct/16/claude-skills/
Servo v0.0.1 Released,https://github.com/servo/servo/releases/tag/v0.0.1
Fast calculation of the distance to cubic Bezier curves on the GPU,https://blog.pkh.me/p/46-fast-calculation-of-the-distance-to-cubic-bezier-curves-on-the-gpu.html
Argentina Could Be a Superpower,https://unchartedterritories.tomaspueyo.com/p/argentina-could-be-a-superpower
Commodore 64 Ultimate,https://www.commodore.net/product-page/commodore-64-ultimate-basic-beige-batch1
How does Turbo listen for Turbo Streams,https://ducktypelabs.com/how-does-turbo-listen-for-turbo-streams/
The working-class hero of Bletchley Park you didn't see in the movies,https://www.theguardian.com/world/2025/oct/12/move-over-alan-turing-meet-the-working-class-hero-of-bletchley-park-you-didnt-see-in-the-movies
OpenAI researcher announced GPT-5 math breakthrough that never happened,https://the-decoder.com/leading-openai-researcher-announced-a-gpt-5-math-breakthrough-that-never-happened/
GoFundMe created 1.4M donation pages for nonprofits; organizations had no clue,https://abc7news.com/post/gofundme-created-14-million-donation-pages-nonprofits-bay-area-organizations-had-no-clue/18013410/
How one of the longest dinosaur trackways in the world was uncovered in the UK,https://www.bbc.co.uk/news/resources/idt-5f8c77b0-92bc-40f2-bf21-6793abbe5ffe
Xubuntu.org Might Be Compromised,https://old.reddit.com/r/Ubuntu/comments/1oa4549/xubuntuorg_might_be_compromised/
The Unix Executable as a Smalltalk Method [pdf],https://programmingmadecomplicated.wordpress.com/wp-content/uploads/2025/10/onward25-jakubovic.pdf
"When you opened a screen shot of a video in Paint, the video was playing in it",https://devblogs.microsoft.com/oldnewthing/20251014-00/?p=111681
Root System Drawings,https://images.wur.nl/digital/collection/coll13/search
Supabase us-east-1 down,https://status.supabase.com
"Feed me up, Scotty – custom RSS feed generation using CSS selectors",https://feed-me-up-scotty.vincenttunru.com/
The Rubygems.org takeover,https://lwn.net/SubscriberLink/1040778/77d921001b26d061/
New Work by Gary Larson,https://www.thefarside.com/new-stuff
Webflow Donates $150k to Support Astro's Open Source Mission,https://astro.build/blog/webflow-official-partner/
EQ: A video about all forms of equalizers,https://www.youtube.com/watch?v=CLAt95PrwL4
Picturing Mathematics,https://mathenchant.wordpress.com/2025/10/18/picturing-mathematics/
A Tiny Typo May Explain Centuries-Old Mystery Bout Chaucer's 'Canterbury Tales',https://www.smithsonianmag.com/smart-news/a-tiny-typo-may-explain-a-centuries-old-mystery-about-chaucers-canterbury-tales-and-troilus-and-criseyde-180986991/
Show HN: Duck-UI – Browser-Based SQL IDE for DuckDB,https://demo.duckui.com
Lux: A luxurious package manager for Lua,https://github.com/lumen-oss/lux
Could the XZ backdoor been detected with better Git/Deb packaging practices?,https://optimizedbyotto.com/post/xz-backdoor-debian-git-detection/
"Chen-Ning Yang, Nobel laureate, dies at 103",https://www.chinadaily.com.cn/a/202510/18/WS68f3170ea310f735438b5bf2.html
What Do We Do If SETI Is Successful?,https://www.universetoday.com/articles/what-do-we-do-if-seti-is-successful
"Ask HN: As a developer, am I wrong to think monitoring alerts are mostly noise?",item?id=45647577
Adding Breadcrumbs to a Rails Application,https://avohq.io/blog/breadcrumbs-rails
The case for the return of fine-tuning,https://welovesota.com/article/the-case-for-the-return-of-fine-tuning
Our Paint – A featureless but programmable painting program,https://www.WellObserve.com/OurPaint/index_en.html
Argentine peso weakens to fresh low despite US interventions,https://www.ft.com/content/815ef487-0d0e-430c-b140-9bc39dbd1a53
Who invented deep residual learning?,https://people.idsia.ch/~juergen/who-invented-residual-neural-networks.html
"Grandmaster, Popular Commentator Daniel Naroditsky Tragically Passes Away at 29",https://www.chess.com/news/view/grandmaster-daniel-naroditsky-dies-at-29
The Trinary Dream Endures,https://www.robinsloan.com/lab/trinary-dream/
Tech Workers versus Enshittification - Cory Doctorow,https://cacm.acm.org/opinion/tech-workers-versus-enshittification/
Amazon’s Ring to partner with Flock,https://techcrunch.com/2025/10/16/amazons-ring-to-partner-with-flock-a-network-of-ai-cameras-used-by-ice-feds-and-police/
"SIM Farm Dismantled in Europe, Seven Arrested",https://www.securityweek.com/sim-farm-dismantled-in-europe-seven-arrested/
PlayStation 3 Architecture (2021),https://www.copetti.org/writings/consoles/playstation-3
Ripgrep 15.0,https://github.com/BurntSushi/ripgrep/releases/tag/15.0.0
"Life, Work, Death and the Peasant, Part V: Life in Cycles",https://acoup.blog/2025/10/17/collections-life-work-death-and-the-peasant-part-v-life-in-cycles/
I'm a principal engineer at Microsoft. I barely program anymore,https://payne.io/posts/historical-artifact/
Replua.nvim – an Emacs-style scratch buffer for executing Lua,https://github.com/mghaight/replua.nvim
Sonoluminescence,https://en.wikipedia.org/wiki/Sonoluminescence
Lost Jack Kerouac story found among assassinated mafia boss' belongings,https://www.sfgate.com/sf-culture/article/lost-jack-kerouac-chapter-found-mafia-boss-estate-21098566.php
"The Rapper 50 Cent, Adjusted for Inflation",https://50centadjustedforinflation.com/
"Police Break Up Lego Theft Ring, Recovering Hundreds of Beheaded Figurines",https://www.nytimes.com/2025/10/18/us/lego-theft-california-arrest.html
Show HN: Browser-based PDF form fields detection (YOLO-based),https://commonforms.simplepdf.com/
Why the open social web matters now,https://werd.io/why-the-open-social-web-matters-now/
Modeling Others' Minds as Code,https://arxiv.org/abs/2510.01272
./watch,https://dotslashwatch.com/
How to sequence your DNA for <$2k,https://maxlangenkamp.substack.com/p/how-to-sequence-your-dna-for-2k
Apple M5 chip,https://www.apple.com/newsroom/2025/10/apple-unleashes-m5-the-next-big-leap-in-ai-performance-for-apple-silicon/
Ask HN: How to stop an AWS bot sending 2B requests/month?,item?id=45613567
FSF announces Librephone project,https://www.fsf.org/news/librephone-project
Exploring PostgreSQL 18's new UUIDv7 support,https://aiven.io/blog/exploring-postgresql-18-new-uuidv7-support
Carefully Educated to Be Idiots,https://www.hilarylayne.com/p/very-carefully-educated-to-be-idiots
Flowistry: An IDE plugin for Rust that focuses on relevant code,https://github.com/willcrichton/flowistry
Coral NPU: A full-stack platform for Edge AI,https://research.google/blog/coral-npu-a-full-stack-platform-for-edge-ai/
Redis Backplane for Hubots,https://github.com/hubot-friends/hubot-redis-backplane
Fury Mounts over a Global A.I. Frenzy,https://www.nytimes.com/2025/10/20/technology/ai-data-center-backlash-mexico-ireland.html
Bible and Quran apps flagged NSFW by F-Droid,https://forum.f-droid.org/t/nsfw-flag-incorrectly-added-to-bible-and-quran-apps/33401
WebMCP,https://github.com/jasonjmcghee/WebMCP
"AWS outage shows internet users 'at mercy' of too few providers, experts say",https://www.theguardian.com/technology/2025/oct/20/amazon-web-services-aws-outage-hits-dozens-websites-apps
SQL Anti-Patterns,https://datamethods.substack.com/p/sql-anti-patterns-you-should-avoid
Asking AI to build scrapers should be easy right?,https://www.skyvern.com/blog/asking-ai-to-build-scrapers-should-be-easy-right/
Claude Skills,https://www.anthropic.com/news/skills
Using Pegs in Janet,https://articles.inqk.net/2020/09/19/how-to-use-pegs-in-janet.html
When if is just a function,https://ryelang.org/blog/posts/if-as-function-blogpost-working-on-it_ver1/
Tinnitus Neuromodulator,https://mynoise.net/NoiseMachines/neuromodulationTonesGenerator.php
The early Unix history of chown() being restricted to root,https://utcc.utoronto.ca/~cks/space/blog/unix/ChownRestrictionEarlyHistory
"Designing EventQL, an Event Query Language",https://docs.eventsourcingdb.io/blog/2025/10/20/designing-eventql-an-event-query-language/
Read your way through Hà Nội,https://vietnamesetypography.com/samples/read-your-way-through-ha-noi/
Original C64 Lode Runner Source Code,https://github.com/Piddewitt/Loderunner
Moonlander.BAS,https://basic-code.bearblog.dev/moonlander/
One Star,https://www.vice.com/en/article/one-star/
Meow.camera,https://meow.camera/
DOJ seizes $15B in Bitcoin from 'pig butchering' scam based in Cambodia,https://www.cnbc.com/2025/10/14/bitcoin-doj-chen-zhi-pig-butchering-scam.html
K8s with 1M nodes,https://bchess.github.io/k8s-1m/
The pivot,https://www.antipope.org/charlie/blog-static/2025/10/the-pivot-1.html
Ruby core team takes ownership of RubyGems and Bundler,https://www.ruby-lang.org/en/news/2025/10/17/rubygems-repository-transition/
StageConnect: Behringer protocol is open source,https://github.com/OpenMixerProject/StageConnect
The zipper is getting its first major upgrade in 100 years,https://www.wired.com/story/the-zipper-is-getting-its-first-major-upgrade-in-100-years/
Jupyter Collaboration has a history slider,https://blog.jupyter.org/exploring-a-documents-timeline-in-jupyterlab-6084f96db263
"BQN ""Macros"" with •Decompose (2023)",https://saltysylvi.github.io/blog/bqn-macros.html
Satellite images show ancient hunting traps used by South American social groups,https://phys.org/news/2025-10-satellite-images-reveal-ancient-south.html
Is Postgres read heavy or write heavy?,https://www.crunchydata.com/blog/is-postgres-read-heavy-or-write-heavy-and-why-should-you-care
Cloudflare Sandbox SDK,https://sandbox.cloudflare.com/
AI will never be your friend,https://www.msn.com/en-us/entertainment/news/ai-will-never-be-your-friend/ar-AA1OObbs
